{
  "$schema": "https://www.saltdesignsystem.com/ai/schemas/salt-pattern-migration-receipt-1.json",
  "baseline": {
    "checkpoint_sha": "37b1a7dcdecd171fd05e52497d9813bfaa7bb88e",
    "contract": "salt-pattern-migration-baseline/1",
    "inventory_sha256": "sha256:27785d6505a813186089f92c6ae7a2ff09cc74c900186e668aab562da07d9d4d",
    "path": "tooling/ai/pattern-migration-v1.json",
    "sha256": "sha256:5e6608255233ed61f355769f011b5e340fefec31b99be4c9555616c0f4435f08"
  },
  "batch": "06b",
  "classified_changes": [
    "package.json",
    "packages/core/stories/floating-platform/floating-platform.mdx",
    "packages/core/stories/introduction.mdx",
    "packages/core/stories/semantic-icon-provider/semantic-icon-provider.mdx",
    "packages/styles/README.md",
    "packages/styles/stories/introduction.mdx",
    "site/docs/components/floating-platform/index.mdx",
    "site/docs/components/semantic-icon-provider/usage.mdx",
    "site/src/examples/patterns/manifest.json"
  ],
  "contract": "salt-pattern-migration-receipt/1",
  "inventory": {
    "example_manifest_sha256": "sha256:f1ca6723cadbc5f395c161551c3cfaf7fba3b72cd11c7f5d04e9d40810bc85d8",
    "package_stories": [
      {
        "batch": "06b",
        "destination": "site/docs/components/floating-platform/index.mdx",
        "destination_sha256": "sha256:9ffbf965f45f14284afb9974aab7cf5a4e44b7243b001b8aa2a006cc50409cf3",
        "disposition": "migrate",
        "maintainer_facade": null,
        "owner": "salt-core-maintainers",
        "retirement_reason": null,
        "source_path": "packages/core/stories/floating-platform/floating-platform.mdx",
        "source_sha256": "sha256:69788e8848aff8a03983ed441ff726c4aadbc190b919f9545af4368f0e9c2631",
        "status": "complete"
      },
      {
        "batch": "06b",
        "destination": null,
        "destination_sha256": null,
        "disposition": "retire",
        "maintainer_facade": null,
        "owner": "salt-core-maintainers",
        "retirement_reason": "The source only redirected readers to the canonical Salt website and retained no unique supported guidance.",
        "source_path": "packages/core/stories/introduction.mdx",
        "source_sha256": "sha256:2d06359ac2994c87822134281bfc396239dd55847920ba8bab87f15aaf33de1b",
        "status": "complete"
      },
      {
        "batch": "06b",
        "destination": "site/docs/components/semantic-icon-provider/usage.mdx",
        "destination_sha256": "sha256:0771cb1a1ca37ee2c0bd9ddee884692d40bc5e59c7503b44a359967b0ba244bd",
        "disposition": "merge",
        "maintainer_facade": null,
        "owner": "salt-core-maintainers",
        "retirement_reason": null,
        "source_path": "packages/core/stories/semantic-icon-provider/semantic-icon-provider.mdx",
        "source_sha256": "sha256:6dcb13d15f10d11b9a889fd0c173bbd56dfc5ddb7df21b88e42d3309aa8a20e8",
        "status": "complete"
      },
      {
        "batch": "06c",
        "destination": "site/docs/components/layouts/deck-layout/index.mdx",
        "destination_sha256": null,
        "disposition": "migrate",
        "maintainer_facade": null,
        "owner": "salt-lab-maintainers",
        "retirement_reason": null,
        "source_path": "packages/lab/stories/deck-layout/deck-layout.mdx",
        "source_sha256": "sha256:7f09e5a2e3c1308c4514c32bd936693fb247a38b4d64c9bf8505430adcb85dad",
        "status": "planned"
      },
      {
        "batch": "06c",
        "destination": "site/docs/components/layouts/layer-layout/index.mdx",
        "destination_sha256": null,
        "disposition": "migrate",
        "maintainer_facade": null,
        "owner": "salt-lab-maintainers",
        "retirement_reason": null,
        "source_path": "packages/lab/stories/layer-layout/layer-layout.mdx",
        "source_sha256": "sha256:662fa3e1f74ce58353e82eb487d2b32f31cd0db15fe88cff1f7d3afaa62f382a",
        "status": "planned"
      },
      {
        "batch": "06c",
        "destination": "site/docs/components/layouts/index.mdx",
        "destination_sha256": null,
        "disposition": "merge",
        "maintainer_facade": null,
        "owner": "salt-lab-maintainers",
        "retirement_reason": null,
        "source_path": "packages/lab/stories/layout/layouts.mdx",
        "source_sha256": "sha256:2327e8efc7093675d84d18b0a082abe97723ce00088cb13fa89e8053375ca374",
        "status": "planned"
      },
      {
        "batch": "06c",
        "destination": "packages/window/README.md",
        "destination_sha256": null,
        "disposition": "merge",
        "maintainer_facade": null,
        "owner": "salt-window-maintainers",
        "retirement_reason": null,
        "source_path": "packages/lab/stories/window/window.mdx",
        "source_sha256": "sha256:1043307eff5ac5fa2549eda9ee43f335a6a7732035f4217bc43e013d32143e28",
        "status": "planned"
      },
      {
        "batch": "06b",
        "destination": "packages/styles/README.md",
        "destination_sha256": "sha256:d9e0b015c2010c2c6d579c80ce7d25a7f565a9ef7fe3d9cc58973e10487a9144",
        "disposition": "merge",
        "maintainer_facade": null,
        "owner": "salt-styles-maintainers",
        "retirement_reason": null,
        "source_path": "packages/styles/stories/introduction.mdx",
        "source_sha256": "sha256:180268bb877612ffe2e8132833ffd9bff81a765fddb1fec6fbf02fc60b033ae4",
        "status": "complete"
      }
    ],
    "package_story_count": 8,
    "pattern_count": 24,
    "patterns": [
      {
        "batch": "06b",
        "content_sha256": "sha256:af9bcb82e110f0dc798cef88fbd4394d5eef9924bc1a6fcf9aa34537c1644389",
        "example_closure_sha256": "sha256:805c10226ee8511a0a86e35de6f5f2e19003cdcc93172363f9d6b3171db4d0e0",
        "example_id": "announcement-dialog",
        "id": "announcement-dialog",
        "record_key": "record:pattern:pattern.announcement-dialog",
        "record_sha256": "sha256:bb6977d19b4b25d2b996824f344139c27371b043262cc5381a92270a417d674c",
        "status": "complete"
      },
      {
        "batch": "06b",
        "content_sha256": "sha256:1ffcf31cda465496f40c5ece8912abbfd7a0384f6c16bbc1615b737041e42135",
        "example_closure_sha256": "sha256:58ae36d1b5a7e1df14628d6aac0c57a7aa3ebcf65c43584e939f97309d430bd7",
        "example_id": "app-header",
        "id": "app-header",
        "record_key": "record:pattern:pattern.app-header",
        "record_sha256": "sha256:1d338ade38452faceb8cb9b32aa33c2ecdcbec7de189206fd4745b3e7e7aa877",
        "status": "complete"
      },
      {
        "batch": "06b",
        "content_sha256": "sha256:649dce492a97dc83ed3552142d534f49493f9bf72bf13a1e3d53563dbd3bf572",
        "example_closure_sha256": "sha256:172d46a2d6a4173516b2e1e8c0c3810805c8e1ccb1f36437b87acff5a994b57b",
        "example_id": "breadcrumbs",
        "id": "breadcrumbs",
        "record_key": "record:pattern:pattern.breadcrumbs",
        "record_sha256": "sha256:37b8c39ec5972c9dcee23d15ab52fb8f88b771d69f6919a891d2bc6767bd4608",
        "status": "complete"
      },
      {
        "batch": "06b",
        "content_sha256": "sha256:15fc51dbd78d7049402b5690b8d8498d53ca993b42cf2ee760a11e07d3b6507e",
        "example_closure_sha256": "sha256:ac72d9a3566a9e9d3d5e8bbc7263344ea16e508846415a7342c87fd9382002fe",
        "example_id": "button-bar",
        "id": "button-bar",
        "record_key": "record:pattern:pattern.button-bar",
        "record_sha256": "sha256:6d25dbc0b279b6bf50d78a0560fd5e905dfda91741cb59bd8b690be07891ed4f",
        "status": "complete"
      },
      {
        "batch": "06b",
        "content_sha256": "sha256:9b9ca19deeedcfb6ed905f2dcfc72364ef75002b2e03c200fdd042d6f77de87b",
        "example_closure_sha256": "sha256:53a3b270e14e38056c0d66fae6f8a4ce4f71af8b18c8872d295fec303d2f6101",
        "example_id": "comments",
        "id": "comments",
        "record_key": "record:pattern:pattern.comments",
        "record_sha256": "sha256:4136d2b16602b1c13c221e496d96642f3d52937296c4ff62ce23c38e21a1a164",
        "status": "complete"
      },
      {
        "batch": "06b",
        "content_sha256": "sha256:44d6b0d62f631fd54722ab06dcdd958580af78efbca8b14f0fc74cdab903a93b",
        "example_closure_sha256": "sha256:b286e28151265b0dd150dc9603882f1e6e9e8bbaadb1f73d20c5b19d105d4e4e",
        "example_id": "contact-details",
        "id": "contact-details",
        "record_key": "record:pattern:pattern.contact-details",
        "record_sha256": "sha256:328b87b28ed526045949d1e8c518d20cb3845e3ff42bb7bbef037c8cbe8a8393",
        "status": "complete"
      },
      {
        "batch": "06b",
        "content_sha256": "sha256:a459e3f53140046ad5b1de00e4e7ce2702a55bf981dd0e8097145d10d8c6c96c",
        "example_closure_sha256": "sha256:a38e4a1e719f14365e4c7d8c37a7b50a49fcc780ae829089403a9fcd5a109235",
        "example_id": "content-status",
        "id": "content-status",
        "record_key": "record:pattern:pattern.content-status",
        "record_sha256": "sha256:d9657aa8169f15bac962391f955706abe80a387a6847efe0750b8f9fc21600c8",
        "status": "complete"
      },
      {
        "batch": "06b",
        "content_sha256": "sha256:45b18fb1abe339ed1c2f3668ccff5ce9231a78b34c2c673b4bac6fe69503e4c2",
        "example_closure_sha256": "sha256:937c65f02e62a3b86201019c5a255d314ef3303ca6d4c4dcdbca9665bc7e2a91",
        "example_id": "experience-customization",
        "id": "experience-customization",
        "record_key": "record:pattern:pattern.experience-customization",
        "record_sha256": "sha256:76d18cb0ddefd6e1000f1dff8f2eeeede1efeabcd49e13a4aa5831511c3b5624",
        "status": "complete"
      },
      {
        "batch": "06b",
        "content_sha256": "sha256:5167263476a0bfe75f1b79f5abbed53100a3d53b40bd7e667366d449c170776a",
        "example_closure_sha256": "sha256:8a07a168b9e79e3d594224395c00648c57ed98114219f72b1a679effdddaafeb",
        "example_id": "file-upload",
        "id": "file-upload",
        "record_key": "record:pattern:pattern.file-upload",